building_id,url,area,location,description,diary_entry_count,conservation_recorded,space_count,space_numbers,feature_count,feature_numbers_raw,bin_count,wall_count,pit_count,fire_installation_count,floor_count,hearth_count,oven_count,burial_count,other_feature_count,unit_count,architectural_complexity_score,raw_text_excerpt
105,http://db.catalhoyuk.com/BuildingSheet.asp?num=105,Trench 5,"southwest in the trench JMR 14.8.2011 EW 4.9m, NS 5.4; Building 105 is a building with many internal construction features, probably indicating several construction phases. Excavation of Building 105 is not yet finished, the lower and southern part remain unexcavated. Building 105 abuts B.106 in the east, B.107 in the north and a building limited by wall F.3345 in the south. Towards west, Building 105 might have cut or been cut by buildings containing walls F.3349 and/or F.3350. Related Photo (Click to view larger version in new window)",,111,No,1,342,14,3311 | other | 3311 (bench);3310 | other | <br/> 3310 (bench);3303 | wall | <br/> 3303 (wall);2424 | wall | <br/> 2424 (wall);5051 | wall | <br/> 5051 (wall feature);5069 | burial | <br/> 5069 (burial);5062 | wall | 5062 (wall);3300 | burial | <br/> 3300 (burial);5061 | other | <br/> 5061 <br/>;5063 | wall | <br/> 5063 (wall);3341 | wall | <br/> 3341 (wall);3352 | wall | 3352 (wall);3346 | other | <br/> 3346 (bench);3353 | other | <br/> 3353 (platform),0,7,0,0,0,0,0,2,5,108,69.5,"Çatalhöyük Research Project: On-line Database Facility: Building Sheet Skip to main content English Visit Us Contact Home The Site The Project Research Portal Partners Building 105 Area: Trench 5 Location: southwest in the trench JMR 14.8.2011 EW 4.9m, NS 5.4; Building 105 is a building with many internal construction features, probably indicating several construction phases. Excavation of Building 105 is not yet finished, the lower and southern part remain unexcavated. Building 105 abuts B.106 in the east, B.107 in the north and a building limited by wall F.3345 in the south. Towards west, Building 105 might have cut or been cut by buildings containing walls F.3349 and/or F.3350. Related Photo (Click to view larger version in new window) Number of Related Diary Entries: 111 Conservation Recorded: No Related Photos: 97 (Opens as a group in a new window) Space Numbers Related to this Building : (Click to view the record) 342 Feature Numbers Related to this Building : (Click to view the record) 3311 (bench) 3310 (bench) 3303 (wall) 2424 (wall) 5051 (wall feature) 5069 (burial) 5062 (wall) 3300 (burial) 5061 5063 (wall) 3341 (wall) 3352 (wall) 3346 (bench) 3353 (platform) No. Of Units"
106,http://db.catalhoyuk.com/BuildingSheet.asp?num=106,Trench 5,"south in the trench JMR 14.8.2011 NS 4.3m, EW 4.1m; Building 106 is formed by spaces 310 and 454, it has a longish rectangular from, slightly irregular in the south (Space 454), Building 106 was built on top of older structures (Sp.453, Space 461) and built abutting other buildings: B.105 to the west, B.98 to the north, and building containing Space 345 to the east and another building bordered by wall F.3354 to the south. Related Photo (Click to view larger version in new window)",,90,No,2,310;454,9,2427 | wall | 2427 (wall);3301 | wall | <br/> 3301 (wall);3302 | wall | <br/> 3302 (wall);2408 | wall | <br/> 2408 (wall);5058 | wall | 5058 (wall);3386 | wall | <br/> 3386 (wall);3376 | wall | <br/> 3376 (wall);3314 | wall | 3314 (wall);3351 | other | <br/> 3351 <br/>,0,8,0,0,0,0,0,0,1,88,56.0,"Çatalhöyük Research Project: On-line Database Facility: Building Sheet Skip to main content English Visit Us Contact Home The Site The Project Research Portal Partners Building 106 Area: Trench 5 Location: south in the trench JMR 14.8.2011 NS 4.3m, EW 4.1m; Building 106 is formed by spaces 310 and 454, it has a longish rectangular from, slightly irregular in the south (Space 454), Building 106 was built on top of older structures (Sp.453, Space 461) and built abutting other buildings: B.105 to the west, B.98 to the north, and building containing Space 345 to the east and another building bordered by wall F.3354 to the south. Related Photo (Click to view larger version in new window) Number of Related Diary Entries: 90 Conservation Recorded: No Related Photos: 96 (Opens as a group in a new window) Space Numbers Related to this Building : (Click to view the record) 310 , 454 Feature Numbers Related to this Building : (Click to view the record) 2427 (wall) 3301 (wall) 3302 (wall) 2408 (wall) 5058 (wall) 3386 (wall) 3376 (wall) 3314 (wall) 3351 No. Of Units identified in this Building: 88 Click to view unit list << Back Download this Buildings Data Database Browse Search Terminology He"
107,http://db.catalhoyuk.com/BuildingSheet.asp?num=107,Trench 5,"northwest in the trench Building 107 is limited by walls F.3344, F.2426, F.2425/5050 and F.5074. As the base levels of these walls are very different, it is unclear as to where a potential floor/walking surface might have been. The western buttress has not yet been identified, F.3356 is built from the same material as the othern features of the building, but its top level is below the base of the western wall F.3344. Building 107 was constructed on top of an older building (Sp.462) with its walls and buttresses having been constructed directly on top of the features surrounding the Space 462, except for F.3344, which is sitting on very homogeneous fill on top of an unknown fill or construction feature (not yet fully excavated). Building 107 was built abutting Building 98 in the east, Building 105 in the south, and a building bordered by F.2429 to the north. It is not yet clear what was west of it. Its dimensions are NS 4.5m, EW 4.7m. Related Photo (Click to view larger version in new window)",,75,No,1,343,12,3373 | wall | 3373 (wall);3374 | wall | <br/> 3374 (wall);2426 | wall | <br/> 2426 (wall feature);3337 | wall | <br/> 3337 (wall);2425 | wall | <br/> 2425 (wall);5050 | wall | 5050 (wall feature);3375 | wall | <br/> 3375 (wall);3378 | wall | <br/> 3378 (wall);5074 | wall | <br/> 5074 (wall);3338 | wall | 3338 (wall);3339 | wall | <br/> 3339 (wall);3344 | wall | <br/> 3344 (wall),0,12,0,0,0,0,0,0,0,40,33.5,"Çatalhöyük Research Project: On-line Database Facility: Building Sheet Skip to main content English Visit Us Contact Home The Site The Project Research Portal Partners Building 107 Area: Trench 5 Location: northwest in the trench Building 107 is limited by walls F.3344, F.2426, F.2425/5050 and F.5074. As the base levels of these walls are very different, it is unclear as to where a potential floor/walking surface might have been. The western buttress has not yet been identified, F.3356 is built from the same material as the othern features of the building, but its top level is below the base of the western wall F.3344. Building 107 was constructed on top of an older building (Sp.462) with its walls and buttresses having been constructed directly on top of the features surrounding the Space 462, except for F.3344, which is sitting on very homogeneous fill on top of an unknown fill or construction feature (not yet fully excavated). Building 107 was built abutting Building 98 in the east, Building 105 in the south, and a building bordered by F.2429 to the north. It is not yet clear what was west of it. Its dimensions are NS 4.5m, EW 4.7m. Related Photo (Click to view larger version in"
108,http://db.catalhoyuk.com/BuildingSheet.asp?num=108,North,"Between B.77 and B.52+Sp.90 Eroded building within the North Shelter. No features left, although a few burials are associated with Sp.84. Began excavation in 2012. Not fully excavated.",,14,Yes,2,84;501,20,7851 | other | 7851 (other);7330 | burial | <br/> 7330 (burial);3644 | burial | <br/> 3644 (burial);3624 | wall | <br/> 3624 (wall);7331 | burial | <br/> 7331 (burial);3088 | burial | <br/> 3088 (burial);3089 | burial | <br/> 3089 (burial);6065 | burial | <br/> 6065 (burial);3084 | burial | 3084 (burial);3622 | burial | <br/> 3622 (burial);3626 | wall | <br/> 3626 (wall);3627 | wall | <br/> 3627 (wall);3638 | other | <br/> 3638 (bench);3623 | wall | <br/> 3623 (wall);3637 | wall | <br/> 3637 (wall);3635 | other | 3635 (bench);3625 | wall | <br/> 3625 (wall);3634 | other | <br/> 3634 (bench);7106 | pit | <br/> 7106 (pit);3636 | wall | <br/> 3636 (wall),0,7,1,0,0,0,0,8,4,66,56.0,"Çatalhöyük Research Project: On-line Database Facility: Building Sheet Skip to main content English Visit Us Contact Home The Site The Project Research Portal Partners Building 108 Area: North Location: Between B.77 and B.52+Sp.90 Eroded building within the North Shelter. No features left, although a few burials are associated with Sp.84. Began excavation in 2012. Not fully excavated. Number of Related Diary Entries: 14 Conservation Recorded: Yes Count of records: : 1 Space Numbers Related to this Building : (Click to view the record) 84 , 501 Feature Numbers Related to this Building : (Click to view the record) 7851 (other) 7330 (burial) 3644 (burial) 3624 (wall) 7331 (burial) 3088 (burial) 3089 (burial) 6065 (burial) 3084 (burial) 3622 (burial) 3626 (wall) 3627 (wall) 3638 (bench) 3623 (wall) 3637 (wall) 3635 (bench) 3625 (wall) 3634 (bench) 7106 (pit) 3636 (wall) No. Of Units identified in this Building: 66 Click to view unit list << Back Download this Buildings Data Database Browse Search Terminology Help << Previous Page Archive Reports Illustration Photography Videos main sponsors secondary sponsors collaborating institutions British Institute at Ankara Stanford University Un"
109,http://db.catalhoyuk.com/BuildingSheet.asp?num=109,"TPC this is the youngest building in the sequence of the Trench 1 TPC. It is badly preserved, only two parts of walls (N-E) and (S-W) remained. Related Photo (Click to view larger version in new window)",,,0,No,1,499,2,3909 | wall | 3909 (wall);3908 | wall | <br/> 3908 (wall),0,2,0,0,0,0,0,0,0,4,5.5,"Çatalhöyük Research Project: On-line Database Facility: Building Sheet Skip to main content English Visit Us Contact Home The Site The Project Research Portal Partners Building 109 Area: TPC this is the youngest building in the sequence of the Trench 1 TPC. It is badly preserved, only two parts of walls (N-E) and (S-W) remained. Related Photo (Click to view larger version in new window) Number of Related Diary Entries: 0 Conservation Recorded: No Related Photos: 1 (Opens as a group in a new window) Space Numbers Related to this Building : (Click to view the record) 499 Feature Numbers Related to this Building : (Click to view the record) 3909 (wall) 3908 (wall) No. Of Units identified in this Building: 4 Click to view unit list << Back Download this Buildings Data Database Browse Search Terminology Help << Previous Page Archive Reports Illustration Photography Videos main sponsors secondary sponsors collaborating institutions British Institute at Ankara Stanford University Universite de Bordeaux Duke University University of California Merced University of York Cardiff University Selcuk University Ege University Adam Mickiewicz University SUNY Buffalo Turkish Cultural Foundation Ox"
110,http://db.catalhoyuk.com/BuildingSheet.asp?num=110,TPC this is the oldest building in the sequence of Trench1 TPC. It was marked on Mellaart's plan as Building 5 (level III).,,,2,No,2,485;486,6,3995 | other | 3995 <br/>;3911 | wall | <br/> 3911 (wall);3927 | wall | <br/> 3927 (wall);3912 | wall | 3912 (wall);7184 | other | <br/> 7184 <br/>;7168 | pit | 7168 (pit),0,3,1,0,0,0,0,0,2,45,31.5,"Çatalhöyük Research Project: On-line Database Facility: Building Sheet Skip to main content English Visit Us Contact Home The Site The Project Research Portal Partners Building 110 Area: TPC this is the oldest building in the sequence of Trench1 TPC. It was marked on Mellaart's plan as Building 5 (level III). Number of Related Diary Entries: 2 Conservation Recorded: No Related Photos: 38 (Opens as a group in a new window) Space Numbers Related to this Building : (Click to view the record) 485 , 486 Feature Numbers Related to this Building : (Click to view the record) 3995 3911 (wall) 3927 (wall) 3912 (wall) 7184 7168 (pit) No. Of Units identified in this Building: 45 Click to view unit list << Back Download this Buildings Data Database Browse Search Terminology Help << Previous Page Archive Reports Illustration Photography Videos main sponsors secondary sponsors collaborating institutions British Institute at Ankara Stanford University Universite de Bordeaux Duke University University of California Merced University of York Cardiff University Selcuk University Ege University Adam Mickiewicz University SUNY Buffalo Turkish Cultural Foundation Oxford University catalhoyuk.com by Cata"
111,http://db.catalhoyuk.com/BuildingSheet.asp?num=111,TPC Related Photo (Click to view larger version in new window),,,0,No,2,482;538,6,7464 | wall | 7464 (wall);7465 | wall | <br/> 7465 (wall);3926 | wall | <br/> 3926 (wall);8094 | wall | 8094 (wall);3909 | wall | <br/> 3909 (wall);3908 | wall | 3908 (wall),0,6,0,0,0,0,0,0,0,17,17.5,"Çatalhöyük Research Project: On-line Database Facility: Building Sheet Skip to main content English Visit Us Contact Home The Site The Project Research Portal Partners Building 111 Area: TPC Related Photo (Click to view larger version in new window) Number of Related Diary Entries: 0 Conservation Recorded: No Related Photos: 4 (Opens as a group in a new window) Space Numbers Related to this Building : (Click to view the record) 482 , 538 Feature Numbers Related to this Building : (Click to view the record) 7464 (wall) 7465 (wall) 3926 (wall) 8094 (wall) 3909 (wall) 3908 (wall) No. Of Units identified in this Building: 17 Click to view unit list << Back Download this Buildings Data Database Browse Search Terminology Help << Previous Page Archive Reports Illustration Photography Videos main sponsors secondary sponsors collaborating institutions British Institute at Ankara Stanford University Universite de Bordeaux Duke University University of California Merced University of York Cardiff University Selcuk University Ege University Adam Mickiewicz University SUNY Buffalo Turkish Cultural Foundation Oxford University catalhoyuk.com by Catalhoyuk Research Project is licensed under a Cre"
112,http://db.catalhoyuk.com/BuildingSheet.asp?num=112,North,"North end of North Shelter, between B.1 and B.102 B.112 is located immediately northeast of B.5 within the northern end of the North Shelter. The building was partially defined in the surface scrape that took place in 1993. At that point the building, which was not given a number, was interpreted to have been made up of spaces 35 and 36 to the north with a main space, space 38 to the south that contained a cell-like space, sp. 37 within its northwestern corner. Excavations within the building took place in 2013 in spaces 37 and 38. Most of the building’s features were eroded away. However, excavations revealed that in fact the outer boundaries that defined these two spaces were in fact walls that have been directly built upon a predecessor, B.119. The relationship of spaces 35 and 36 are not clear to the rest of the building. Excavations that took place in 2007 in the northern beam-slot foundation trench revealed wall that was highly eroded that aligns perfectly the building’s eastern wall F.220. This feature clearly runs beyond the northern extent of spaces 37 and 38. It is quite possible for spaces 35 and 36 to have been associated with B.112, but the nature of that association (external space, courtyard, pen, side room?) is unclear. Buildings with small rooms about 1 to 1.5m2 that have been typically named 'cell' spaces in Southwest Asian Neolithic are not common at Çatalhöyük, although B.128 located immediately east of B.112 has a similar configuration. Note that the internal square meter Calculation is based only on Spaces 37 and 38.",,0,No,3,37;38;599,6,220 | wall | 220 (wall);3672 | wall | <br/> 3672 (wall);7102 | wall | <br/> 7102 (wall);3673 | wall | 3673 (wall);3674 | wall | <br/> 3674 (wall);3671 | wall | 3671 (wall),0,6,0,0,0,0,0,0,0,15,18.0,"Çatalhöyük Research Project: On-line Database Facility: Building Sheet Skip to main content English Visit Us Contact Home The Site The Project Research Portal Partners Building 112 Area: North Location: North end of North Shelter, between B.1 and B.102 B.112 is located immediately northeast of B.5 within the northern end of the North Shelter. The building was partially defined in the surface scrape that took place in 1993. At that point the building, which was not given a number, was interpreted to have been made up of spaces 35 and 36 to the north with a main space, space 38 to the south that contained a cell-like space, sp. 37 within its northwestern corner. Excavations within the building took place in 2013 in spaces 37 and 38. Most of the building’s features were eroded away. However, excavations revealed that in fact the outer boundaries that defined these two spaces were in fact walls that have been directly built upon a predecessor, B.119. The relationship of spaces 35 and 36 are not clear to the rest of the building. Excavations that took place in 2007 in the northern beam-slot foundation trench revealed wall that was highly eroded that aligns perfectly the building’s easte"
113,http://db.catalhoyuk.com/BuildingSheet.asp?num=113,North 2012 Not fully excavated. Evidence of burning. Largely eroded. 2014 The part of foundations of the B113 within the section of,,"This building was excavated in 2014, new space number (527) was allocated since partition wall (F3676) did not have foundation wall and the whole foundations were all together filled with infill. Studying of the section of the building revealed previous occupation phase (midden like layers belonging to earlier space 532) that was cut and disturbed by B113. Unearthing the S wall of B114 (N from B113) revealed plaster on its S face and possible sealed crawl hole indicating possibility of another space of B114 S from space 87that was dismantled by erection of B113 (making it later than at least some phases of B114). The excavation of B77 revealed the W face of its W walls and heavy burning turned the bricks of F3648 black from reom the side of B77 which points (contrary to what was previously believed) that the building 113 was there when burning of B77 happened. BT 2016 Building 113 was uncovered and partially excavated during the 2012 and 2014 field seasons. It is comprised of two spaces, main room space 96 and side room space 95. Trapezoid in plan, it measures 7.75m in length, 4.40m in width by its southern end and 6.5m in width by its northern end. In 2012, the building was cross-sectioned along a north-south axis and most of the deposits that remained in the eastern half of the building were excavated. In 2014, focus of excavation was given to the construction of the building, which showed that it was built on a very deep foundation. The building is currently assigned to level 4040.G. It was built after B.114, and is thought to have been destroyed by the conflagration that took place in B.77. Even though the building had the deepest foundations recorded up to this day at Catalhoyuk, it was likely a short-lived building evidenced through a very shallow occupation sequence that did not reveal any skeletons.",4,No,4,95;96;527;607,11,7613 | wall | 7613 (wall);3677 | wall | <br/> 3677 (wall);1022 | wall | <br/> 1022 (wall);7619 | wall | <br/> 7619 (wall);3650 | bin | <br/> 3650 (bin);3649 | bin | 3649 (bin);7341 | wall | <br/> 7341 (wall);3647 | wall | <br/> 3647 (wall);3676 | wall | <br/> 3676 (wall);3648 | wall | 3648 (wall);7100 | wall | <br/> 7100 (wall),2,9,0,0,0,0,0,0,0,65,53.5,"Çatalhöyük Research Project: On-line Database Facility: Building Sheet Skip to main content English Visit Us Contact Home The Site The Project Research Portal Partners Building 113 Area: North 2012 Not fully excavated. Evidence of burning. Largely eroded. 2014 The part of foundations of the B113 within the section of this building was excavated in 2014, new space number (527) was allocated since partition wall (F3676) did not have foundation wall and the whole foundations were all together filled with infill. Studying of the section of the building revealed previous occupation phase (midden like layers belonging to earlier space 532) that was cut and disturbed by B113. Unearthing the S wall of B114 (N from B113) revealed plaster on its S face and possible sealed crawl hole indicating possibility of another space of B114 S from space 87that was dismantled by erection of B113 (making it later than at least some phases of B114). The excavation of B77 revealed the W face of its W walls and heavy burning turned the bricks of F3648 black from reom the side of B77 which points (contrary to what was previously believed) that the building 113 was there when burning of B77 happened. BT 2016 "
114,http://db.catalhoyuk.com/BuildingSheet.asp?num=114,North,"Between Sp.85, B.3 and B.113 Building number assigned in 2012, but not fully excavated and relationships need to made the following season. 2016 Update: A small building that comprises of spaces 88 and 87. Investigations in 2016 showed that another space south of the building that belonged to it was truncated by the construction of B113. The building is not fully excavated, although it seems as though its earliest phases have been reached. Related Photo (Click to view larger version in new window)",,5,Yes,3,87;88;608,46,7114 | other | 7114 (platform);8101 | fire installation | <br/> 8101 (fire installation);7304 | other | <br/> 7304 (ledge/shelf);7303 | other | <br/> 7303 (ledge/shelf);7129 | pit | <br/> 7129 (pit);7343 | pit | <br/> 7343 (pit);7607 | fire installation | <br/> 7607 (fire installation);1024 | wall | <br/> 1024 (wall);151 | burial | <br/> 151 (burial);163 | wall | <br/> 163 (wall);165 | other | <br/> 165 (platform);166 | wall | <br/> 166 (interior wall);610 | other | <br/> 610 (setup for the grinding stone);627 | other | <br/> 627 (niche);638 | other | <br/> 638 (platform);1002 | burial | <br/> 1002 (burial);1003 | bin | 1003 (basin/bin);1005 | burial | <br/> 1005 (burial);1007 | burial | <br/> 1007 (burial);1012 | burial | <br/> 1012 (burial);1013 | burial | <br/> 1013 (burial);1014 | burial | <br/> 1014 (burial);1015 | bin | <br/> 1015 (bin);1018 | wall | <br/> 1018 (wall);1019 | wall | <br/> 1019 (south wall of 88);7615 | burial | <br/> 7615 (burial);3629 | burial | <br/> 3629 (burial);7113 | pit | <br/> 7113 (post pit);7567 | other | <br/> 7567 (Step);7345 | fire installation | <br/> 7345 (fire installation);1020 | wall | <br/> 1020 (wall);8146 | other | 8146 (platform);8144 | other | <br/> 8144 (niche/recess);8148 | wall | <br/> 8148 (wall feature);7614 | burial | <br/> 7614 (burial);8102 | other | <br/> 8102 (niche/recess);8103 | fire installation | <br/> 8103 (fire installation);3680 | wall | <br/> 3680 (wall);3681 | wall | <br/> 3681 (wall);3682 | wall | <br/> 3682 (wall);8142 | other | <br/> 8142 (kerb);7631 | wall | <br/> 7631 (wall feature);8145 | other | <br/> 8145 (access hole);8143 | other | <br/> 8143 (niche/recess);8855 | other | <br/> 8855 (Post);8100 | burial | <br/> 8100 (burial),2,11,3,4,0,0,0,11,15,252,180.5,"Çatalhöyük Research Project: On-line Database Facility: Building Sheet Skip to main content English Visit Us Contact Home The Site The Project Research Portal Partners Building 114 Area: North Location: Between Sp.85, B.3 and B.113 Building number assigned in 2012, but not fully excavated and relationships need to made the following season. 2016 Update: A small building that comprises of spaces 88 and 87. Investigations in 2016 showed that another space south of the building that belonged to it was truncated by the construction of B113. The building is not fully excavated, although it seems as though its earliest phases have been reached. Related Photo (Click to view larger version in new window) Number of Related Diary Entries: 5 Conservation Recorded: Yes Count of records: : 1 Related Photos: 103 (Opens as a group in a new window) Space Numbers Related to this Building : (Click to view the record) 87 , 88 , 608 Feature Numbers Related to this Building : (Click to view the record) 7114 (platform) 8101 (fire installation) 7304 (ledge/shelf) 7303 (ledge/shelf) 7129 (pit) 7343 (pit) 7607 (fire installation) 1024 (wall) 151 (burial) 163 (wall) 165 (platform) 166 (interior wall) 610 (s"
