building_id,url,area,location,description,diary_entry_count,conservation_recorded,space_count,space_numbers,feature_count,feature_numbers_raw,bin_count,wall_count,pit_count,fire_installation_count,floor_count,hearth_count,oven_count,burial_count,other_feature_count,unit_count,architectural_complexity_score,raw_text_excerpt
49,http://db.catalhoyuk.com/BuildingSheet.asp?num=49,"North Building 49 is located in the 4040 area, within grid squares 1050N/1165E and 1050N/1170E. Building 49 had an irregular floor plan, with the northeast corner indented. The building measured approximately 3.85m north-south and 4.30m east-west; with an internal ground plan of c.14.70m². Building 49 consisted of a central occupation area, Space 100, and a smaller side room, Space 334. Building 49 was constructed on the same footprint of an earlier building; however the walls were slightly offset. To the north of Building 49 Spaces 103 and 97 were defined during the 1993-94 surface scrape. Neither spaces have been excavated, and hence are poorly understood; however they probably represent further buildings extending to the north. On all other sides Building 49 was bounded by houses, although it shared no common walls with these structures. To the east Building 48 is another small house, consisting of Space 239 and a small northern storage area Space 234. To the south Building 82 consists of Spaces 229 an external Space 241. To the west Space 98 is associated with Building 51, and was built following the burning of Building 52. The excavation of Building 49 was initially undertaken by the Stanford University field school in the 2003 and 2004 seasons. Excavation of the building was continued in the 2006 and 2008 seasons by the Çatalhöyük Research Project. Building 49 was completely excavated in order to understand the occupational sequence within the structure. Despite its diminutive size Building 49 contained a complex stratigraphic sequence, and represents an architecturally and decoratively elaborate house. The depth of deposits within the building, with evidence of numerous architectural alterations and additions suggests that the house was occupied for a considerable period of time. Despite constant alteration of the building there is also great continuity, with most major features used throughout the occupation. This continuity can also be seen in the reuse of material from earlier construction phases when altering features within the building. Excavation revealed a typical pattern of dirtier floors in the south of the building, associated with a hearth and an oven, and cleaner white floors in the north. The central floors of the building appear to represent more mixed use with both clean and dirty surfaces. The patchy, worn nature of the floors across the centre of the building indicates regular use. As with most of the houses excavated at the site, most of the surfaces inside Building 49 appear to have been kept very clean during its use, and as a result relatively few finds were recovered from stratified occupation deposits. Several areas of painted plaster were present in Building 49, including geometric wall paintings with red and black paint, walls and features painted solid red, as well as more figurative decoration on the face of the northwest platform. Hearth or oven F.1665 was located in SE corner of Building 49, a typical position for such fire instillations. This feature was sub-rectangular in plan and built against platform F.1666 and a combination of hearth rebuilds and additions to the platform resulted in an expansion of platform F.1666 to the east. The location and size and activities associated with western Space 234 fits a pattern of these small side rooms being used as storage rooms. Fifteen burials were excavated from Building 49. Fourteen individuals were buried under the northern to platforms and the limbless torso of an older individual was buried in the central area of the building. The majority of the skeletons were disturbed, including six which were missing their skulls and other bones. All of the burials were tightly flexed and several of the burials included grave goods. It is in the northern area that the majority of the painted decoration was concentrated, and this may be in some way associated with the burial process. 2006: Excavation of building 49 continued in the later part of the 2006 season and continues to be an interesting structure. The depth and complexity of the stratigraphy within space 100 contrasts sharply with the diminutive size of the building. The building was obviously occupied for a considerable period of time and the patchy worn floors across the centre of the building suggest heavy and regular use. The typical pattern of dirtier floors in the south of the building, associated with hearths and ovens, and cleaner white floors in the north appears to replicated here. The central floor are of the building appears to represent more mixed use with both clean and dirty floors. The stratigraphy of building 49 is particularly complex and represents the constant alteration and modification of the space with what appears to be puzzling frequency. As well as the addition of new floors and features there is also a constant cutting back and re-modelling of earlier features, as if the occupants are never quite happy with their living environment. Both the building infill of building 49 and the fill of post retrieval pit [13641] contained horn cores and other interesting animal bones. The material recovered from the post retrieval pit this season was not deliberately placed but dumped within a mixed demolition fill. It is far from clear to me whether this material was deliberately included within the fill or simply dumped material it was not considered worth salvaging during the demolition of the building. Burial F1492, which cut through the construction layer of platform F1656, was undoubtedly curious. The burial consisted of the limbless torso of an older male with the legs, arms and shoulder blades all removed prior to burial. The ribs and sternum were in place indicating the body was at least partially fleshed at the time of burial. If the initial analysis of the bones is correct, and no cut marks are present, this suggests the body must have been heavily de-fleshed prior to the removal of the limbs and its subsequent burial. The plaster was removed from sections of the northern and western walls of building 49, directly above the NW platform F1651. Several layers of painted plaster were encountered. On the northern later layer of paint appeared to consist of a solid red colour. Earlier layers 13669 contained geometric designs in red and black paint. Similarly on the western wall a series of overlying designs 13676, in red and black paint, were recorded. The paintings appear to have been plastered over relatively quickly and then repainted, an identical design was repainted in exactly the same location each time. The designs on the different layers match so closely it is at times difficult to tell them apart. On the western wall the painting appears to be very early in the sequence, a micro-morphology sample taken from the wall will allow the number of layers of plaster to be counted. Initial examination with the naked eye suggest and initial thick foundation layer was put on the wall, the first few layers of plaster contain the painted designs, these are then sealed by a second thick make up layer and then a series of typically thin re-plastering events. Click on the Plan below to view the related Space, Feature and Unit Sheets",,,17,Yes,2,100;334,53,7126 | wall | 7126 (wall);4028 | burial | <br/> 4028 (burial);1652 | other | <br/> 1652 (basin);1651 | other | <br/> 1651 (platform);1654 | wall | <br/> 1654 (wall);1655 | wall | <br/> 1655 (wall);1656 | other | <br/> 1656 (platform);1657 | wall | <br/> 1657 (wall);1666 | other | <br/> 1666 (platform);1662 | other | <br/> 1662 (platform);1653 | other | <br/> 1653 (bench);1658 | wall | <br/> 1658 (wall);1659 | wall | <br/> 1659 (wall);1660 | wall | <br/> 1660 (wall);1661 | wall | <br/> 1661 (wall);1663 | floor | <br/> 1663 (floors);1664 | other | <br/> 1664 (platform);1665 | fire installation | <br/> 1665 (fire installation);1497 | other | <br/> 1497 (basin);1498 | other | 1498 (basin);1491 | wall | <br/> 1491 (wall);1493 | other | <br/> 1493 (post);1496 | other | <br/> 1496 (post);1492 | burial | <br/> 1492 (burial);1494 | other | <br/> 1494 (post);1495 | bin | <br/> 1495 (bin);4021 | burial | <br/> 4021 (burial);4003 | fire installation | <br/> 4003 (fire installation);4008 | other | <br/> 4008 (platform);4024 | burial | <br/> 4024 (burial);4023 | burial | <br/> 4023 (burial);4022 | burial | <br/> 4022 (burial);4025 | other | <br/> 4025 (platform);4026 | other | <br/> 4026 (platform);4027 | other | <br/> 4027 (basin);4002 | pit | <br/> 4002 (pit/scoop);4005 | pit | <br/> 4005 (pit/scoop);4009 | burial | 4009 (burial);4006 | other | <br/> 4006 (platform);4018 | pit | <br/> 4018 (pit/scoop);4015 | burial | <br/> 4015 (burial);4011 | burial | <br/> 4011 (burial);4014 | burial | <br/> 4014 (burial);4016 | other | <br/> 4016 (kerb);4004 | other | <br/> 4004 (Post);4020 | pit | <br/> 4020 (pit/scoop);4007 | other | <br/> 4007 (platform);4013 | burial | <br/> 4013 (burial);4017 | other | <br/> 4017 (kerb);4010 | other | <br/> 4010 (basin);4019 | burial | <br/> 4019 (burial);4000 | burial | <br/> 4000 (burial);4012 | burial | <br/> 4012 (burial),1,9,4,2,1,0,0,14,22,517,316.5,"Çatalhöyük Research Project: On-line Database Facility: Building Sheet Skip to main content English Visit Us Contact Home The Site The Project Research Portal Partners Building 49 Area: North Building 49 is located in the 4040 area, within grid squares 1050N/1165E and 1050N/1170E. Building 49 had an irregular floor plan, with the northeast corner indented. The building measured approximately 3.85m north-south and 4.30m east-west; with an internal ground plan of c.14.70m². Building 49 consisted of a central occupation area, Space 100, and a smaller side room, Space 334. Building 49 was constructed on the same footprint of an earlier building; however the walls were slightly offset. To the north of Building 49 Spaces 103 and 97 were defined during the 1993-94 surface scrape. Neither spaces have been excavated, and hence are poorly understood; however they probably represent further buildings extending to the north. On all other sides Building 49 was bounded by houses, although it shared no common walls with these structures. To the east Building 48 is another small house, consisting of Space 239 and a small northern storage area Space 234. To the south Building 82 consists of Spaces "
50,http://db.catalhoyuk.com/BuildingSheet.asp?num=50,"South MELLAART SHRINE 9 E.VII.7 space 112, extended northwards in 2003 to excavate whole builing incorporated under shelter in 2001 Click on the Plan below to view the related Space, Feature and Unit Sheets",,,0,No,2,112;231,31,52 | wall | 52 (wall);83 | burial | <br/> 83 (burial);84 | burial | <br/> 84 (burial);85 | wall | <br/> 85 (wall);86 | other | <br/> 86 (platform);89 | burial | <br/> 89 (burial);90 | wall | <br/> 90 (wall);96 | fire installation | <br/> 96 (fire installation);251 | burial | <br/> 251 (burial);253 | wall | <br/> 253 (wall);258 | burial | <br/> 258 (burial);259 | wall | 259 (wall);265 | burial | <br/> 265 (burial);274 | burial | <br/> 274 (burial);267 | wall | <br/> 267 (wall);275 | pit | <br/> 275 (pit);276 | pit | <br/> 276 (pit);277 | burial | <br/> 277 (burial);286 | wall | <br/> 286 (wall);1701 | wall | <br/> 1701 (wall);1703 | pit | <br/> 1703 (post pit);1704 | other | 1704 (niche/recess);1705 | pit | <br/> 1705 (post pit);1709 | burial | <br/> 1709 (burial);1711 | burial | <br/> 1711 (burial);1702 | burial | <br/> 1702 (burial);1700 | wall | <br/> 1700 (wall);1708 | other | <br/> 1708 (niche/recess);1706 | other | <br/> 1706 (niche/recess);1710 | burial | <br/> 1710 (burial);2539 | wall | <br/> 2539 (wall),0,10,4,1,0,0,0,12,4,160,114.0,"Çatalhöyük Research Project: On-line Database Facility: Building Sheet Skip to main content English Visit Us Contact Home The Site The Project Research Portal Partners Building 50 Area: South MELLAART SHRINE 9 E.VII.7 space 112, extended northwards in 2003 to excavate whole builing incorporated under shelter in 2001 Click on the Plan below to view the related Space, Feature and Unit Sheets Number of Related Diary Entries: 0 Conservation Recorded: No Space Numbers Related to this Building : (Click to view the record) 112 , 231 Feature Numbers Related to this Building : (Click to view the record) 52 (wall) 83 (burial) 84 (burial) 85 (wall) 86 (platform) 89 (burial) 90 (wall) 96 (fire installation) 251 (burial) 253 (wall) 258 (burial) 259 (wall) 265 (burial) 274 (burial) 267 (wall) 275 (pit) 276 (pit) 277 (burial) 286 (wall) 1701 (wall) 1703 (post pit) 1704 (niche/recess) 1705 (post pit) 1709 (burial) 1711 (burial) 1702 (burial) 1700 (wall) 1708 (niche/recess) 1706 (niche/recess) 1710 (burial) 2539 (wall) No. Of Units identified in this Building: 160 Click to view unit list << Back Download this Buildings Data Database Browse Search Terminology Help << Previous Page Archive Reports Il"
51,http://db.catalhoyuk.com/BuildingSheet.asp?num=51,North,"central 4040 shelter Building 51 comprised a single small room Space 98. Two stepped platforms lay against the north wall with a niche cut into the east wall leading on to the NE platform and a post pit at the southern end of it. Phytolith traces of a woven mat were also clearly preserved on the surface of the NE platform. The southern area of the building functioned as the food production area with a hearth surrounded by a raised boundary. There was no oven but the hearth was set relatively close to the southern wall in the position where ovens are frequently positioned and is the likely location of the entrance ladder. Positioned in the southeastern corner were a bench, a pedestal, and a double basin. The most important piece of information about this structure is that it appears to have been built as a replacement for Building 52, which was destroyed by fire. Building 51 was constructed within the walls of a cleared out area of the burnt building in the northeast corner. (updated SF Sept 2009 Click on the Plan below to view the related Space, Feature and Unit Sheets",,8,Yes,1,98,13,1573 | fire installation | 1573 (fire installation);1574 | other | <br/> 1574 (platform);1575 | other | <br/> 1575 (platform);1576 | pit | <br/> 1576 (post retrieval pit);1577 | wall | <br/> 1577 (wall);1578 | wall | 1578 (wall);1579 | wall | <br/> 1579 (wall);1580 | wall | <br/> 1580 (wall);1581 | other | <br/> 1581 (podium/pedestal);1582 | other | 1582 (kerb);1583 | other | <br/> 1583 (bench);1584 | other | <br/> 1584 (basin);1479 | wall | <br/> 1479 (wall),0,5,1,1,0,0,0,0,6,119,74.0,"Çatalhöyük Research Project: On-line Database Facility: Building Sheet Skip to main content English Visit Us Contact Home The Site The Project Research Portal Partners Building 51 Area: North Location: central 4040 shelter Building 51 comprised a single small room Space 98. Two stepped platforms lay against the north wall with a niche cut into the east wall leading on to the NE platform and a post pit at the southern end of it. Phytolith traces of a woven mat were also clearly preserved on the surface of the NE platform. The southern area of the building functioned as the food production area with a hearth surrounded by a raised boundary. There was no oven but the hearth was set relatively close to the southern wall in the position where ovens are frequently positioned and is the likely location of the entrance ladder. Positioned in the southeastern corner were a bench, a pedestal, and a double basin. The most important piece of information about this structure is that it appears to have been built as a replacement for Building 52, which was destroyed by fire. Building 51 was constructed within the walls of a cleared out area of the burnt building in the northeast corner. (updated "
52,http://db.catalhoyuk.com/BuildingSheet.asp?num=52,North,"North of 10x40 stripe excavated in 2005 B52 is located north from the ""street"" and south from the possible open area S90. Spaces 91, 92, 93, 94 form the western part of the building, whileits eastern part is covered by the construction of B51. There seem to have been two other spaces 254 and 255 part of the same building since there is a crawl hole between S94 and S254 and since S255 and S94 under the B51, have a common burnt wall. Nevertheless, S91 and S92 seem to have been a later addition to B52, but it is possible that in that area there were spaces related to B52 also previously, but they got backfilled and walking level raised. The disuse of B52 seems to have been an accidental fire, that caused the burning of the walls and their collapse inside the rooms. Subsequently B51 was constructed directly in it, in the eastern half, very close to the floor. This was done by cuting through the burnt infill at lest one meter deep, with a precise lcation on an existing internal division line. This indicates that the construction of B51 occurred relatively close after the destruction of B52. NOTE - Space 254 is void and has been replaced by space 290 and 291. (DE 22-07-06) Click on the Plan below to view the related Space, Feature and Unit Sheets",,20,Yes,10,91;92;93;94;254;290;291;377;576;645,140,2011 | wall | 2011 (wall);7775 | other | <br/> 7775 <br/>;7772 | pit | <br/> 7772 (pit);7777 | other | <br/> 7777 (basin);7778 | other | <br/> 7778 (basin);7779 | other | <br/> 7779 (pillar);7776 | wall | <br/> 7776 (wall);8500 | other | <br/> 8500 (Ladder emplacement);3694 | other | <br/> 3694 (platform);7758 | fire installation | <br/> 7758 (fire installation);7759 | other | <br/> 7759 (other);7767 | other | <br/> 7767 (bench);7773 | other | <br/> 7773 (Post);7753 | wall | <br/> 7753 (wall);7118 | other | <br/> 7118 (bench);8515 | burial | <br/> 8515 (burial);7642 | other | <br/> 7642 (Step);7637 | floor | <br/> 7637 (floor);7119 | other | <br/> 7119 (basin);7123 | other | <br/> 7123 (Step);7750 | floor | <br/> 7750 (floor);7751 | pit | <br/> 7751 (post pit);7554 | wall | <br/> 7554 (wall);7120 | burial | <br/> 7120 (burial);7127 | burial | <br/> 7127 (burial);7112 | burial | <br/> 7112 (burial);7223 | other | <br/> 7223 (Step);1574 | other | <br/> 1574 (platform);1575 | other | <br/> 1575 (platform);1576 | pit | <br/> 1576 (post retrieval pit);1577 | wall | <br/> 1577 (wall);1578 | wall | <br/> 1578 (wall);1580 | wall | <br/> 1580 (wall);1582 | other | <br/> 1582 (kerb);2003 | bin | <br/> 2003 (bin);2006 | burial | <br/> 2006 (burial);2014 | wall | <br/> 2014 (wall);2010 | wall | <br/> 2010 (wall);2012 | wall | <br/> 2012 (wall);2013 | wall | <br/> 2013 (wall);2004 | bin | <br/> 2004 (bin);2007 | wall | <br/> 2007 (wall);2008 | wall | <br/> 2008 (wall);2040 | other | <br/> 2040 (basket);2021 | other | <br/> 2021 (bench);2106 | wall | <br/> 2106 (wall);2032 | wall | <br/> 2032 (wall);2035 | wall | <br/> 2035 (wall);2172 | other | 2172 (Post);2173 | pit | <br/> 2173 (post pit);2174 | other | <br/> 2174 (platform);2175 | other | <br/> 2175 (niche/recess);2177 | other | <br/> 2177 (platform);2178 | other | <br/> 2178 (post);2184 | other | <br/> 2184 (Post);2185 | wall | <br/> 2185 (wall);2186 | other | <br/> 2186 (access hole);2179 | other | <br/> 2179 (Post);2181 | other | <br/> 2181 (access hole);2182 | other | <br/> 2182 (niche);2183 | wall | <br/> 2183 (wall);2016 | wall | <br/> 2016 (wall);2015 | wall | <br/> 2015 (wall);2002 | bin | <br/> 2002 (bin);2005 | bin | <br/> 2005 (bin);1477 | other | <br/> 1477 (niche/recess);1487 | other | <br/> 1487 (basin);1488 | other | <br/> 1488 (niche/recess);1486 | wall | <br/> 1486 (wall);1489 | wall | <br/> 1489 (wall);1480 | pit | <br/> 1480 (post pit);1481 | other | <br/> 1481 (niche/recess);1482 | fire installation | <br/> 1482 (fire installation);1483 | other | <br/> 1483 (podium/pedestal);1484 | other | <br/> 1484 (Ladder emplacement);1485 | fire installation | <br/> 1485 (fire installation);4060 | fire installation | <br/> 4060 (fire installation);4062 | wall | <br/> 4062 (wall);4061 | other | <br/> 4061 (basin);4065 | other | <br/> 4065 (niche/recess);4051 | wall | <br/> 4051 (wall);4052 | burial | <br/> 4052 (burial);4053 | burial | <br/> 4053 (burial);7316 | other | <br/> 7316 <br/>;2195 | fire installation | <br/> 2195 (fire installation);8502 | other | <br/> 8502 (bench);8507 | other | <br/> 8507 (bench);8538 | wall | <br/> 8538 (wall);7315 | other | <br/> 7315 (internal partition);8504 | fire installation | <br/> 8504 (fire installation);8517 | wall | <br/> 8517 (wall);8508 | burial | <br/> 8508 (burial);8501 | other | <br/> 8501 (basin);8505 | other | <br/> 8505 (bench);8537 | other | <br/> 8537 (bench);8520 | other | 8520 (bench);8519 | other | <br/> 8519 (bench);8509 | burial | <br/> 8509 (burial);8518 | fire installation | <br/> 8518 (fire installation);8512 | bin | <br/> 8512 (bin);8506 | wall | <br/> 8506 (wall);8513 | pit | <br/> 8513 (pit);7555 | other | <br/> 7555 (cache/hoard);1626 | other | <br/> 1626 (access hole);7638 | floor | <br/> 7638 (floor);7620 | pit | <br/> 7620 (post pit);7606 | burial | <br/> 7606 (burial);7587 | pit | <br/> 7587 (pit);7636 | other | <br/> 7636 (Step);7765 | pit | <br/> 7765 (pit);7766 | wall | <br/> 7766 (wall feature);7332 | other | <br/> 7332 (other);7754 | other | <br/> 7754 (access hole);7761 | other | <br/> 7761 (access hole);7586 | pit | <br/> 7586 (pit);7589 | pit | <br/> 7589 (pit);7588 | pit | <br/> 7588 (pit);7585 | pit | <br/> 7585 (pit);7334 | burial | <br/> 7334 (burial);7575 | pit | <br/> 7575 (post pit);7612 | other | <br/> 7612 (Post);2109 | other | <br/> 2109 (access hole);7770 | pit | <br/> 7770 (post pit);7774 | wall | <br/> 7774 (wall);7596 | pit | <br/> 7596 (pit);7597 | pit | <br/> 7597 (pit);7605 | other | <br/> 7605 (platform);7617 | other | <br/> 7617 (platform);7573 | pit | <br/> 7573 (post pit);7574 | pit | <br/> 7574 (post pit);7121 | other | <br/> 7121 (podium/pedestal);3695 | other | <br/> 3695 (platform);3693 | other | <br/> 3693 (kerb);2176 | floor | <br/> 2176 (floor);8850 | other | <br/> 8850 (Post);8851 | other | <br/> 8851 (Post);8852 | other | <br/> 8852 (pillar);8853 | other | <br/> 8853 (Post);8854 | other | <br/> 8854 (Post);7768 | floor | <br/> 7768 (floor),5,29,19,7,5,0,0,11,64,423,376.5,"Çatalhöyük Research Project: On-line Database Facility: Building Sheet Skip to main content English Visit Us Contact Home The Site The Project Research Portal Partners Building 52 Area: North Location: North of 10x40 stripe excavated in 2005 B52 is located north from the ""street"" and south from the possible open area S90. Spaces 91, 92, 93, 94 form the western part of the building, whileits eastern part is covered by the construction of B51. There seem to have been two other spaces 254 and 255 part of the same building since there is a crawl hole between S94 and S254 and since S255 and S94 under the B51, have a common burnt wall. Nevertheless, S91 and S92 seem to have been a later addition to B52, but it is possible that in that area there were spaces related to B52 also previously, but they got backfilled and walking level raised. The disuse of B52 seems to have been an accidental fire, that caused the burning of the walls and their collapse inside the rooms. Subsequently B51 was constructed directly in it, in the eastern half, very close to the floor. This was done by cuting through the burnt infill at lest one meter deep, with a precise lcation on an existing internal division l"
